{"$defs":{"approval":{"additionalProperties":false,"properties":{"contract_merge_commit_sha":{"$ref":"#/$defs/commit"},"contract_pull_request_url":{"pattern":"^https://github\\.com/[^/\\s]+/[^/\\s]+/pull/\\d+$","type":"string"},"prd002_merge_commit_sha":{"$ref":"#/$defs/commit"},"prd002_pull_request_url":{"pattern":"^https://github\\.com/[^/\\s]+/[^/\\s]+/pull/\\d+$","type":"string"}},"required":["contract_merge_commit_sha","contract_pull_request_url","prd002_merge_commit_sha","prd002_pull_request_url"],"type":"object"},"artifact":{"additionalProperties":false,"properties":{"path":{"minLength":1,"type":"string"},"sha256":{"$ref":"#/$defs/sha256"}},"required":["path","sha256"],"type":"object"},"commit":{"pattern":"^[a-f0-9]{40}$","type":"string"},"extractor":{"additionalProperties":false,"properties":{"git_commit_sha":{"$ref":"#/$defs/nullableCommit"},"node_major":{"const":24},"path":{"const":"tools/extract-prd002-expectations.mjs"},"sha256":{"$ref":"#/$defs/sha256"}},"required":["git_commit_sha","node_major","path","sha256"],"type":"object"},"generator":{"additionalProperties":false,"properties":{"git_commit_sha":{"$ref":"#/$defs/nullableCommit"},"node_major":{"const":24},"path":{"const":"tools/runa-contract-generator.mjs"},"sha256":{"$ref":"#/$defs/sha256"},"version":{"const":"0.2.0"}},"required":["git_commit_sha","node_major","path","sha256","version"],"type":"object"},"nullableCommit":{"pattern":"^[a-f0-9]{40}$","type":["string","null"]},"sha256":{"pattern":"^[a-f0-9]{64}$","type":"string"}},"$id":"https://schemas.runacode.io/sdk/runa-sdk-contract.provenance.schema.json","$schema":"https://json-schema.org/draft/2020-12/schema","additionalProperties":false,"allOf":[{"if":{"properties":{"status":{"const":"BLOCKED"}}},"then":{"properties":{"approval_reference":{"type":"null"},"canonical_ref":{"type":"null"},"reason":{"minLength":8,"type":"string"},"source_revision":{"type":"null"}}}},{"if":{"properties":{"status":{"const":"APPROVED"}}},"then":{"properties":{"approval_reference":{"$ref":"#/$defs/approval"},"canonical_ref":{"$ref":"#/$defs/commit"},"reason":{"type":"null"},"source_revision":{"$ref":"#/$defs/commit"}}}}],"properties":{"accepted_baseline_sha256":{"$ref":"#/$defs/sha256"},"approval_reference":{"oneOf":[{"type":"null"},{"$ref":"#/$defs/approval"}]},"artifacts":{"additionalProperties":false,"properties":{"baseline_expectation_manifest":{"$ref":"#/$defs/artifact"},"contract_projection":{"$ref":"#/$defs/artifact"},"snapshot":{"$ref":"#/$defs/artifact"},"snapshot_schema":{"$ref":"#/$defs/artifact"}},"required":["baseline_expectation_manifest","contract_projection","snapshot","snapshot_schema"],"type":"object"},"baseline_extractor_identity":{"$ref":"#/$defs/extractor"},"canonical_ref":{"$ref":"#/$defs/nullableCommit"},"canonical_repository":{"const":"Runa-Laboratories/runa-sdk-contract"},"contract_id":{"const":"runa-sdk-contract"},"generation_command_id":{"const":"runa-contract-generator/v1"},"generator_identity":{"$ref":"#/$defs/generator"},"reason":{"type":["string","null"]},"schema_version":{"const":3},"semantic_change_class":{"enum":["none","additive","behavioral","breaking"]},"snapshot_version":{"pattern":"^\\d+\\.\\d+\\.\\d+$","type":"string"},"source_revision":{"$ref":"#/$defs/nullableCommit"},"status":{"enum":["BLOCKED","APPROVED"]}},"required":["accepted_baseline_sha256","approval_reference","artifacts","baseline_extractor_identity","canonical_ref","canonical_repository","contract_id","generation_command_id","generator_identity","reason","schema_version","semantic_change_class","snapshot_version","source_revision","status"],"title":"Runa SDK contract detached provenance","type":"object"}