{"accepted_baseline_sha256":"65a649fbeb569103703a92dea12110b8697fe95d4e3c4beddf5f818647058776","approval_reference":{"contract_merge_commit_sha":"286bdb84448b61f2f8142bc27daae48ad78cdf63","contract_pull_request_url":"https://github.com/Runa-Laboratories/runa-sdk-contract/pull/9","prd002_merge_commit_sha":"286bdb84448b61f2f8142bc27daae48ad78cdf63","prd002_pull_request_url":"https://github.com/Runa-Laboratories/runa-sdk-contract/pull/9"},"artifacts":{"baseline_expectation_manifest":{"path":"runa-sdk-contract.prd002-expected-manifest.json","sha256":"1b6078b566428fcdb21e1913a1fa012955a5a7ab5dac9b429d1f2bac45aa679b"},"contract_projection":{"path":"runa-sdk-contract.prd002-projection.json","sha256":"1b6078b566428fcdb21e1913a1fa012955a5a7ab5dac9b429d1f2bac45aa679b"},"snapshot":{"path":"runa-sdk-contract.snapshot.json","sha256":"327c6ccc6a4572929ff737bc8b1af6bd3189e139548af632245ce93118368298"},"snapshot_schema":{"path":"runa-sdk-contract.snapshot.schema.json","sha256":"fc2e4041bbafef23fc892662b51172e818b91ed3be675c6b105cd7ac1df0863a"}},"baseline_extractor_identity":{"git_commit_sha":"286bdb84448b61f2f8142bc27daae48ad78cdf63","node_major":24,"path":"tools/extract-prd002-expectations.mjs","sha256":"63cc05143d044ba9dff185567fa03e86ab9ea67ca68a54dde8f8b8a21c11daa7"},"canonical_ref":"286bdb84448b61f2f8142bc27daae48ad78cdf63","canonical_repository":"Runa-Laboratories/runa-sdk-contract","contract_id":"runa-sdk-contract","generation_command_id":"runa-contract-generator/v1","generator_identity":{"git_commit_sha":"286bdb84448b61f2f8142bc27daae48ad78cdf63","node_major":24,"path":"tools/runa-contract-generator.mjs","sha256":"75de6242dde7fccfc9251d371020c5dc5ffb96a65399647b6d54d2c8850202e1","version":"0.2.0"},"reason":null,"schema_version":3,"semantic_change_class":"additive","snapshot_version":"1.2.0","source_revision":"286bdb84448b61f2f8142bc27daae48ad78cdf63","status":"APPROVED"}